<?xml version="1.0" ?>
<xsd:schema xmlns:xsd="http://www.w3.org/2001/XMLSchema">

    <xsd:element name="products">
        <xsd:complexType>
            <xsd:sequence maxOccurs="unbounded">
                <xsd:element name="product">
                    <xsd:complexType>
                        <xsd:sequence>
                            <xsd:element name="name" type="xsd:string" />
                            <xsd:element name="price">
                                <xsd:simpleType>
                                    <xsd:restriction base="xsd:decimal">
                                        <xsd:minInclusive value="0.0" />
                                    </xsd:restriction>
                                </xsd:simpleType>
                            </xsd:element>
                            <xsd:element name="expirationDate" type="xsd:date" nillable="true" />
                            <xsd:element name="stock" type="xsd:string" />
                            <xsd:element name="ratings">
                                <xsd:simpleType>
                                    <xsd:restriction base="xsd:decimal">
                                        <xsd:minInclusive value="0.0" />
                                        <xsd:maxInclusive value="5.0" />
                                    </xsd:restriction>
                                </xsd:simpleType>
                            </xsd:element>
                        </xsd:sequence>
                        <xsd:attribute name="id" type="xsd:string" use="required"/>
                    </xsd:complexType>
                </xsd:element>
            </xsd:sequence>
        </xsd:complexType>
    </xsd:element>

</xsd:schema>
